review,sentiment
Aniston has at last decisively broken with her Friends image in an independent film of satiric fire and emotional turmoil .,3
"On its icy face , the new film is a subzero version of Monsters , Inc. , without the latter 's imagination , visual charm or texture .",0
"If nothing else , `` Rollerball '' 2002 may go down in cinema history as the only movie ever in which the rest of the cast was outshined by LL Cool J.",1
"A compelling pre-WWII drama with vivid characters and a warm , moving message .",4
One can only assume that the jury who bestowed star Hoffman 's brother Gordy with the Waldo Salt Screenwriting award at 2002 's Sundance Festival were honoring an attempt to do something different over actually pulling it off,1
A brutally dry satire of Middle American numbness .,1
Astonishing ... ( frames ) profound ethical and philosophical questions in the form of dazzling pop entertainment .,4
There 's something to be said for a studio-produced film that never bothers to hand viewers a suitcase full of easy answers .,3
"A loud , brash and mainly unfunny high school comedy .",0
"Nicolas Cage is n't the first actor to lead a group of talented friends astray , and this movie wo n't create a ruffle in what is already an erratic career .",1
It seems Grant does n't need the floppy hair and the self-deprecating stammers after all .,2
"Terminally bland , painfully slow and needlessly confusing ... The movie , shot on digital videotape rather than film , is frequently indecipherable .",1
"It understands , in a way that speaks forcefully enough about the mechanisms of poverty to transcend the rather simplistic filmmaking .",2
"Loud , chaotic and largely unfunny .",0
"The film is enriched by an imaginatively mixed cast of antic spirits , headed by Christopher Plummer as the subtlest and most complexly evil Uncle Ralph I 've ever seen in the many film and stage adaptations of the work .",4
Could this be the first major studio production shot on video tape instead of film ?,1
The heat of the moment prevails .,3
One regards Reign of Fire with awe .,4
Those 24-and-unders looking for their own Caddyshack to adopt as a generational signpost may have to keep on looking .,1
"Unspeakable , of course , barely begins to describe the plot and its complications .",0
Suffers from over-familiarity since hit-hungry British filmmakers have strip-mined the Monty formula mercilessly since 1997 .,0
A series of immaculately composed shots of Patch Adams quietly freaking out does not make for much of a movie .,1
Poignant Japanese epic about adolescent anomie and heartbreak .,3
Poignant if familiar story of a young person suspended between two cultures .,3
"A serviceable Euro-trash action extravaganza , with a decent sense of humor and plenty of things that go boom -- handguns , BMWs and seaside chateaus .",2
It uses some of the figures from the real-life story to portray themselves in the film .,3
"The first Tunisian film I have ever seen , and it 's also probably the most good-hearted yet sensual entertainment I 'm likely to see all year .",4
"You 'll forget about it by Monday , though , and if they 're old enough to have developed some taste , so will your kids .",0
`` 13 Conversations About One Thing '' is an intelligent flick that examines many different ideas from happiness to guilt in an intriguing bit of storytelling .,4
Incoherence reigns .,1
"Holds limited appeal to those who like explosions , sadism and seeing people beat each other to a pulp .",2
We just do n't really care too much about this love story .,1
One of the most gloriously unsubtle and adrenalized extreme shockers since The Evil Dead .,3
"An awfully good , achingly human picture .",3
"Despite an overwrought ending , the film works as well as it does because of the performances .",3
"This would-be ` James Bond for the Extreme Generation ' pic is one big , dumb action movie .",0
"Russell lacks the visual panache , the comic touch , and perhaps the budget of Sommers 's title-bout features .",1
"Directed with purpose and finesse by England 's Roger Mitchell , who handily makes the move from pleasing , relatively lightweight commercial fare such as Notting Hill to commercial fare with real thematic heft .",4
"Before it takes a sudden turn and devolves into a bizarre sort of romantic comedy , Steven Shainberg 's adaptation of Mary Gaitskill 's harrowing short story ... is a brilliantly played , deeply unsettling experience .",3
A mess .,1
"Hill looks to be going through the motions , beginning with the pale script .",1
"Rich in shadowy metaphor and as sharp as a samurai sword , Jiang Wen 's Devils on the Doorstep is a wartime farce in the alternately comic and gut-wrenching style of Joseph Heller or Kurt Vonnegut .",4
Eerily accurate depiction of depression .,1
"There are times when you wish that the movie had worked a little harder to conceal its contrivances , but Brown Sugar turns out to be a sweet and enjoyable fantasy .",2
I did n't smile .,1
Conforms itself with creating a game of ` who 's who ' ... where the characters ' moves are often more predictable than their consequences .,1
Dolman confines himself to shtick and sentimentality -- the one bald and the other sloppy .,2
`` The Quiet American '' begins in Saigon in 1952 .,2
"It 's sobering , particularly if anyone still thinks this conflict can be resolved easily , or soon .",2
Waiting for Godard can be fruitful : ` In Praise of Love ' is the director 's epitaph for himself .,3
`` ... something appears to have been lost in the translation this time .,0
"A film really has to be exceptional to justify a three hour running time , and this is n't .",1
"Like its New England characters , most of whom wander about in thick clouds of denial , the movie eventually gets around to its real emotional business , striking deep chords of sadness .",3
"... the first 2/3 of the film are incredibly captivating and insanely funny , thanks in part to interesting cinematic devices ( cool visual backmasking ) , a solid cast , and some wickedly sick and twisted humor ...",4
"A thoroughly enjoyable , heartfelt coming-of-age comedy .",3
"As is often the case with ambitious , eager first-time filmmakers , Mr. Murray , a prolific director of music videos , stuffs his debut with more plot than it can comfortably hold .",1
"This sensitive , smart , savvy , compelling coming-of-age drama delves into the passive-aggressive psychology of co-dependence and the struggle for self-esteem .",4
"Those prone to indignation need not apply ; those susceptible to blue hilarity , step right up .",3
The most consistently funny of the Austin Powers films .,3
"Although made on a shoestring and unevenly acted , conjures a Lynch-like vision of the rotting underbelly of Middle America .",1
"Unfortunately , that 's precisely what Arthur Dong 's Family Fundamentals does .",1
As simple and innocent a movie as you can imagine .,3
"Allegiance to Chekhov , which director Michael Cacoyannis displays with somber earnestness in the new adaptation of The Cherry Orchard , is a particularly vexing handicap .",1
The major problem with Windtalkers is that the bulk of the movie centers on the wrong character .,1
"A quiet , disquieting triumph .",3
... fuses the events of her life with the imagery in her paintings so vividly that the artist 's work may take on a striking new significance for anyone who sees the film .,4
How inept is Serving Sara ?,0
"Shunji Iwai 's All About Lily Chou Chou is a beautifully shot , but ultimately flawed film about growing up in Japan .",1
This film can only point the way -- but thank goodness for this signpost .,3
"Resident Evil is n't a product of its cinematic predecessors so much as an MTV , sugar hysteria , and PlayStation cocktail .",1
"Sheds light on a subject few are familiar with , and makes you care about music you may not have heard before .",3
"Slap me , I saw this movie .",0
I 'd be lying if I said my ribcage did n't ache by the end of Kung Pow .,3
"But mainstream audiences will find little of interest in this film , which is often preachy and poorly acted .",1
"To better understand why this did n't connect with me would require another viewing , and I wo n't be sitting through this one again ... that in itself is commentary enough .",0
"This makes Minority Report necessary viewing for sci-fi fans , as the film has some of the best special effects ever .",4
Intimate and panoramic .,3
"The movie does n't think much of its characters , its protagonist , or of us .",1
"Jacquot has filmed the opera exactly as the libretto directs , ideally capturing the opera 's drama and lyricism .",3
The real question this movie poses is not ` Who ? ',2
"It 's a beautiful film , full of elaborate and twisted characters - and it 's also pretty funny .",4
One ca n't deny its seriousness and quality .,3
"The huskies are beautiful , the border collie is funny and the overall feeling is genial and decent .",3
"Overall , Cletis Tout is a winning comedy that excites the imagination and tickles the funny bone .",4
( A ) rather thinly-conceived movie .,0
"Tells a fascinating , compelling story .",4
Fluffy neo-noir hiding behind cutesy film references .,1
Ultimately this is a frustrating patchwork : an uneasy marriage of Louis Begley 's source novel ( About Schmidt ) and an old Payne screenplay .,1
"You see the movie and you think , zzzzzzzzz .",0
"Its message has merit and , in the hands of a brutally honest individual like Prophet Jack , might have made a point or two regarding life .",1
Highly engaging .,4
And how .,2
"A welcome relief from baseball movies that try too hard to be mythic , this one is a sweet and modest and ultimately winning story .",3
"So earnest and well-meaning , and so stocked with talent , that you almost forget the sheer , ponderous awfulness of its script .",2
"You need n't be steeped in '50s sociology , pop culture or movie lore to appreciate the emotional depth of Haynes ' work .",3
"Like an Afterschool Special with costumes by Gianni Versace , Mad Love looks better than it feels .",1
The emotional overload of female angst irreparably drags the film down .,0
"Dull and mechanical , kinda like a very goofy museum exhibit",2
"Shot largely in small rooms , the film has a gentle , unforced intimacy that never becomes claustrophobic .",4
"both overstuffed and undernourished ... The film ca n't be called a solid success , although there 's plenty of evidence here to indicate Clooney might have better luck next time .",2
"A brain twister , less a movie-movie than a funny and weird meditation on Hollywood , success , artistic integrity and intellectual bankruptcy .",2
"( Evans is ) a fascinating character , and deserves a better vehicle than this facetious smirk of a movie .",1
The dialogue is very choppy and monosyllabic despite the fact that it is being dubbed .,1
"Not only is it a charming , funny and beautifully crafted import , it uses very little dialogue , making it relatively effortless to read and follow the action at the same time .",4
"A sweet , tender sermon about a 12-year-old Welsh boy more curious about God than girls , who learns that believing in something does matter .",3
"If you 're not a fan , it might be like trying to eat Brussels sprouts .",1
That Haynes can both maintain and dismantle the facades that his genre and his character construct is a wonderous accomplishment of veracity and narrative grace .,4
Anyone else seen this before ?,2
"The bland outweighs the nifty , and Cletis Tout never becomes the clever crime comedy it thinks it is .",2
"In one scene , we get a stab at soccer hooliganism , a double-barreled rip-off of Quentin Tarantino 's climactic shootout -- and Meat Loaf explodes .",1
"Too much power , not enough puff .",1
"Benigni presents himself as the boy puppet Pinocchio , complete with receding hairline , weathered countenance and American Breckin Meyer 's ridiculously inappropriate Valley Boy voice .",2
Writer / director M. Night Shyamalan 's ability to pull together easily accessible stories that resonate with profundity is undeniable .,3
"Time stands still in more ways that one in Clockstoppers , a sci-fi thriller as lazy as it is interminable .",1
"I 'm not sure which half of Dragonfly is worse : The part where nothing 's happening , or the part where something 's happening , but it 's stupid .",0
"Swimming is above all about a young woman 's face , and by casting an actress whose face projects that woman 's doubts and yearnings , it succeeds .",4
A delicious and delicately funny look at the residents of a Copenhagen neighborhood coping with the befuddling complications life tosses at them .,4
What you expect is just what you get ... assuming the bar of expectations has n't been raised above sixth-grade height .,0
This film was made by and for those folks who collect the serial killer cards and are fascinated by the mere suggestion of serial killers .,2
Only at the prospect of Beck 's next project .,2
Like a less dizzily gorgeous companion to Mr. Wong 's In the Mood for Love -- very much a Hong Kong movie despite its mainland setting .,2
( A ) satisfying niblet .,3
"This is unusual , food-for-thought cinema that 's as entertaining as it is instructive .",3
There 's none of the happily-ever - after spangle of Monsoon Wedding in Late Marriage -- and that 's part of what makes Dover Kosashvili 's outstanding feature debut so potent .,4
"Plot , characters , drama , emotions , ideas -- all are irrelevant to the experience of seeing The Scorpion King .",1
"While dutifully pulling on heartstrings , directors Dean Deblois and Chris Sanders valiantly keep punching up the mix .",3
"It 's a smart , funny look at an arcane area of popular culture , and if it is n't entirely persuasive , it does give exposure to some talented performers .",3
You can tell almost immediately that Welcome to Collinwood is n't going to jell .,1
"Vera has created a provocative , absorbing drama that reveals the curse of a self-hatred instilled by rigid social mores .",3
"The video work is so grainy and rough , so dependent on being ` naturalistic ' rather than carefully lit and set up , that it 's exhausting to watch .",2
I was impressed by how many tit-for-tat retaliatory responses the filmmakers allow before pulling the plug on the conspirators and averting an American-Russian Armageddon .,3
Those who trek to the ` plex predisposed to like it probably will enjoy themselves .,3
"The plot is nothing but boilerplate clichés from start to finish , and the script assumes that not only would subtlety be lost on the target audience , but that it 's also too stupid to realize that they 've already seen this exact same movie a hundred times",0
"A riveting profile of law enforcement , and a visceral , nasty journey into an urban Hades .",3
"It 's bright , pristine style and bold colors make it as much fun as reading an oversized picture book before bedtime .",3
Consummate actor Barry has done excellent work here .,4
It 's not hateful .,2
"S1M0NE 's satire is not subtle , but it is effective .",3
"The increasingly diverse French director has created a film that one can honestly describe as looking , sounding and simply feeling like no other film in recent history .",4
"Die Another Day is only intermittently entertaining but it 's hard not to be a sucker for its charms , or perhaps it 's just impossible not to feel nostalgia for movies you grew up with .",2
Strange and beautiful film .,3
If only Merchant paid more attention the story .,1
"... the cast portrays their cartoon counterparts well ... but quite frankly , Scoob and Shag do n't eat enough during the film . '",1
"It 's a technically superb film , shining with all the usual Spielberg flair , expertly utilizing the talents of his top-notch creative team .",4
"Hard , endearing , caring , warm .",4
"An achingly enthralling premise , the film is hindered by uneven dialogue and plot lapses .",1
Exploitative and largely devoid of the depth or sophistication that would make watching such a graphic treatment of the crimes bearable .,1
"Directors John Musker and Ron Clements , the team behind The Little Mermaid , have produced sparkling retina candy , but they are n't able to muster a lot of emotional resonance in the cold vacuum of space .",2
Filmmaker Tian Zhuangzhuang triumphantly returns to narrative filmmaking with a visually masterful work of quiet power .,4
"( Toback 's ) fondness for fancy split-screen , stuttering editing and pompous references to Wittgenstein and Kirkegaard ... blends uneasily with the titillating material .",1
Not even Steven Spielberg has dreamed up such blatant and sickening product placement in a movie .,0
( Siegel ) and co-writers Lisa Bazadona and Grace Woodard have relied too much on convention in creating the characters who surround Frankie .,1
Just a Kiss wants desperately to come off as a fanciful film about the typical problems of average people .,2
"Killing time , that 's all that 's going on here .",0
I encourage young and old alike to go see this unique and entertaining twist on the classic whale 's tale -- you wo n't be sorry !,4
Interesting and thoroughly unfaithful version of Carmen,3
"Not only a coming-of-age story and cautionary parable , but also a perfectly rendered period piece .",4
But something seems to be missing .,2
Like a soft drink that 's been sitting open too long : it 's too much syrup and not enough fizz .,0
"The bottom line , at least in my opinion , is Imposter makes a better short story than it does a film .",1
There 's not a fresh idea at the core of this tale .,1
A thought-provoking and often-funny drama about isolation .,3
"A sharp and quick documentary that is funny and pithy , while illuminating an era of theatrical comedy that , while past , really is n't .",3
"For all its brooding quality , Ash Wednesday is suspenseful and ultimately unpredictable , with a sterling ensemble cast .",3
"It 's simply stupid , irrelevant and deeply , truly , bottomlessly cynical .",0
"It should be interesting , it should be poignant , it turns out to be affected and boring .",1
"Instead of a witty expose on the banality and hypocrisy of too much kid-vid , we get an ugly , mean-spirited lashing out by an adult who 's apparently been forced by his kids to watch too many Barney videos .",1
"And more than that , it 's an observant , unfussily poetic meditation about identity and alienation .",3
Michael Moore 's latest documentary about America 's thirst for violence is his best film yet ...,4
into How Long Is This Movie ?,1
"A low-budget affair , Tadpole was shot on digital video , and the images often look smeary and blurry , to the point of distraction .",0
"Director-writer Bille August ... depicts this relationship with economical grace , letting his superb actors convey Martin 's deterioration and Barbara 's sadness -- and , occasionally , anger .",2
This low-rent -- and even lower-wit -- rip-off of the Farrelly brothers ' oeuvre gets way too mushy -- and in a relatively short amount of time .,1
It 's not too racy and it 's not too offensive .,2
Nair does n't use ( Monsoon Wedding ) to lament the loss of culture .,2
"From a deceptively simple premise , this deeply moving French drama develops a startling story that works both as a detailed personal portrait and as a rather frightening examination of modern times .",4
... this is n't even a movie we can enjoy as mild escapism ; it is one in which fear and frustration are provoked to intolerable levels .,0
"Super Troopers is an odd amalgam of comedy genres , existing somewhere between the often literal riffs of early Zucker Brothers/Abrahams films , and the decidedly foul stylings of their post-modern contemporaries , The Farrelly Brothers .",2
The movie is ingenious fun .,4
` Like a child with an important message to tell ... ( Skins ' ) faults are easy to forgive because the intentions are lofty . ',2
( Crystal and De Niro ) manage to squeeze out some good laughs but not enough to make this silly con job sing .,2
"Ben Kingsley is truly funny , playing a kind of Ghandi gone bad .",4
"This would have been better than the fiction it has concocted , and there still could have been room for the war scenes .",1
Sorvino is delightful in the central role .,3
"This is a third-person story now , told by Hollywood , and much more ordinary for it .",1
A powerful performance from Mel Gibson and a brutal 90-minute battle sequence that does everything but issue you a dog-tag and an M-16 .,4
"Stealing Harvard will dip into your wallet , swipe 90 minutes of your time , and offer you precisely this in recompense : A few early laughs scattered around a plot as thin as it is repetitious .",0
Culkin turns his character into what is basically an anti-Harry Potter -- right down to the Gryffindor scarf .,2
As steamy as last week 's pork dumplings .,0
Some stunning visuals -- and some staggeringly boring cinema .,2
"At three hours and with very little story or character development , there is plenty of room for editing , and a much shorter cut surely would have resulted in a smoother , more focused narrative without sacrificing any of the cultural intrigue .",1
Woefully pretentious .,1
What ultimately makes Windtalkers a disappointment is the superficial way it deals with its story .,0
A faster paced family flick .,3
"With elements cribbed from Lang 's Metropolis , Welles ' Kane , and Eisenstein 's Potemkin , the true wonder of Rintarô 's Metropolis is the number of lasting images all its own .",2
It follows the basic plot trajectory of nearly every Schwarzenegger film : Someone crosses Arnie .,2
A true-blue delight .,4
"Unfortunately , One Hour Photo lives down to its title .",0
Remarkable for its intelligence and intensity .,4
"Enigma is well-made , but it 's just too dry and too placid .",1
"Mostly , ( Goldbacher ) just lets her complicated characters be unruly , confusing and , through it all , human .",3
"I have always appreciated a smartly written motion picture , and , whatever flaws Igby Goes Down may possess , it is undeniably that .",3
"About as enjoyable , I would imagine , as searching for a quarter in a giant pile of elephant feces ... positively dreadful .",0
One of the best of a growing strain of daring films ... that argue that any sexual relationship that does n't hurt anyone and works for its participants is a relationship that is worthy of our respect .,3
It 's a rare window on an artistic collaboration .,3
"Imagine a film that begins as a Seven rip-off , only to switch to a mix of The Shining , The Thing , and any naked teenagers horror flick from the 1980s .",1
... a true delight .,4
"` It 's painful to watch Witherspoon 's talents wasting away inside unnecessary films like Legally Blonde and Sweet Home Abomination , I mean , Alabama . '",0
"A bracing , unblinking work that serves as a painful elegy and sobering cautionary tale .",3
Smarter than its commercials make it seem .,3
One of the worst films of 2002 .,0
I could have used my two hours better watching Being John Malkovich again .,1
Maintains your sympathy for this otherwise challenging soul by letting you share her one-room world for a while .,3
It 's absolutely amazing how first-time director Kevin Donovan managed to find something new to add to the canon of Chan .,3
I do n't even care that there 's no plot in this Antonio Banderas-Lucy Liu faceoff .,2
No thanks .,1
"Massoud 's story is an epic , but also a tragedy , the record of a tenacious , humane fighter who was also the prisoner ( and ultimately the victim ) of history .",2
The movie eventually snaps under the strain of its plot contrivances and its need to reassure .,1
"It all starts to smack of a Hallmark Hall of Fame , with a few four letter words thrown in that are generally not heard on television .",1
"The trouble is , its filmmakers run out of clever ideas and visual gags about halfway through .",1
Viewers will need all the luck they can muster just figuring out who 's who in this pretentious mess .,0
This action-thriller/dark comedy is one of the most repellent things to pop up in a cinematic year already littered with celluloid garbage .,1
A different movie -- sometimes tedious -- by a director many viewers would like to skip but film buffs should get to know .,3
You know that ten bucks you 'd spend on a ticket ?,2
`` Abandon '' will leave you wanting to abandon the theater .,0
"Presents a side of contemporary Chinese life that many outsiders will be surprised to know exists , and does so with an artistry that also smacks of revelation .",3
It 's petty thievery like this that puts flimsy flicks like this behind bars,0
A cautionary tale about the folly of superficiality that is itself endlessly superficial .,1
"Go , girls , right down the reality drain .",1
"This is a movie that is what it is : a pleasant distraction , a Friday night diversion , an excuse to eat popcorn .",3
A rambling ensemble piece with loosely connected characters and plots that never quite gel .,1
Take nothing seriously and enjoy the ride .,3
A sustained fest of self-congratulation between actor and director that leaves scant place for the viewer .,1
It manages to squeeze by on Angelina Jolie 's surprising flair for self-deprecating comedy .,3
"Normally , Rohmer 's talky films fascinate me , but when he moves his setting to the past , and relies on a historical text , he loses the richness of characterization that makes his films so memorable .",1
This harrowing journey into combat hell vividly captures the chaotic insanity and personal tragedies that are all too abundant when human hatred spews forth unchecked .,2
The film 's hero is a bore and his innocence soon becomes a questionable kind of inexcusable dumb innocence .,1
"Impresses as a skillfully assembled , highly polished and professional adaptation ... just about as chilling and unsettling as ` Manhunter ' was .",4
Eyre is on his way to becoming the American Indian Spike Lee .,3
