review,sentiment
It 's no accident that The Accidental Spy is a solid action pic that returns the martial arts master to top form .,4
"Despite Juliet Stevenon 's attempt to bring cohesion to Pamela 's emotional roller coaster life , it is not enough to give the film the substance it so desperately needs .",1
"Despite its promising cast of characters , Big Trouble remains a loosely tied series of vignettes which only prove that ` zany ' does n't necessarily mean ` funny . '",1
"A Jewish WW II doc that is n't trying simply to out-shock , out-outrage or out-depress its potential audience !",2
"Lan Yu is certainly a serviceable melodrama , but it does n't even try for the greatness that Happy Together shoots for ( and misses ) .",2
"Drug abuse , infidelity and death are n't usually comedy fare , but Turpin 's film allows us to chuckle through the angst .",3
"It is messy , uncouth , incomprehensible , vicious and absurd .",0
"Like a precious and finely cut diamond , magnificent to behold in its sparkling beauty yet in reality it 's one tough rock .",3
"With this masterful , flawless film , ( Wang ) emerges in the front ranks of China 's now numerous , world-renowned filmmakers .",4
... too sappy for its own good .,1
"However sincere it may be , The Rising Place never quite justifies its own existence .",1
"Slow , silly and unintentionally hilarious .",2
A lame comedy .,0
"Scooby-Doo does n't know if it wants to be a retro-refitting exercise in campy recall for older fans or a silly , Nickelodeon-esque kiddie flick .",1
"The Powerpuff Girls arrive on the big screen with their super-powers , their super-simple animation and their super-dooper-adorability intact .",3
"Has its moments , but it 's pretty far from a treasure .",2
The Sweetest Thing leaves an awful sour taste .,1
"Releasing a film with the word ` dog ' in its title in January lends itself to easy jokes and insults , and Snow Dogs deserves every single one of them .",1
The performances are remarkable .,4
So boring that even its target audience talked all the way through it .,0
"It 's sort of in-between , and it works .",3
"A fantastic premise anchors this movie , but what it needs is either a more rigid , Blair Witch-style commitment to its mockumentary format , or a more straightforward , dramatic treatment , with all the grandiosity that that implies .",2
"Human Nature , in short , is n't nearly as funny as it thinks it is ; neither is it as smart .",1
It 's too bad nothing else is .,2
"Deliberately and devotedly constructed , Far from Heaven is too picture postcard perfect , too neat and new pin-like , too obviously a recreation to resonate .",3
"The urban landscapes are detailed down to the signs on the kiosks , and the color palette , with lots of somber blues and pinks , is dreamy and evocative .",4
A puzzling experience .,2
"Payne has created a beautiful canvas , and Nicholson proves once again that he 's the best brush in the business .",4
"Humorous and heartfelt , Douglas McGrath 's version of ` Nicholas Nickleby ' left me feeling refreshed and hopeful .",4
Adam Sandler 's 8 Crazy Nights is 75 wasted minutes of Sandler as the voice-over hero in Columbia Pictures ' perverse idea of an animated holiday movie .,1
"It 's mildly interesting to ponder the peculiar American style of justice that plays out here , but it 's so muddled and derivative that few will bother thinking it all through .",1
"Since Lee is a sentimentalist , the film is more worshipful than your random E !",2
What a stiflingly unfunny and unoriginal mess this is !,0
"I thought the relationships were wonderful , the comedy was funny , and the love ` real ' .",4
"Williams plays Sy , another of his open-faced , smiling madmen , like the killer in Insomnia .",2
Paid in Full is remarkably engaging despite being noticeably derivative of Goodfellas and at least a half dozen other trouble-in-the-ghetto flicks .,3
It still feels like a prison stretch .,1
An almost unbearably morbid love story .,0
"In its own floundering way , it gets to you .",3
"Last Orders nurtures the multi-layers of its characters , allowing us to remember that life 's ultimately a gamble and last orders are to be embraced .",4
As we have come to learn -- as many times as we have fingers to count on -- Jason is a killer who does n't know the meaning of the word ` quit . ',2
"Feels like nothing quite so much as a middle-aged moviemaker 's attempt to surround himself with beautiful , half-naked women .",2
"Indeed , the more outrageous bits achieve a shock-you-into-laughter intensity of almost Dadaist proportions .",3
"For a movie audience , The Hours does n't connect in a neat way , but introduces characters who illuminate mysteries of sex , duty and love .",2
"Definitely funny stuff , but it 's more of the ` laughing at ' variety than the ` laughing with . '",3
Post 9/11 the philosophical message of `` Personal Freedom First '' might not be as palatable as intended .,2
Certainly the big finish was n't something Galinsky and Hawley could have planned for ... but part of being a good documentarian is being there when the rope snaps .,3
A collage of clichés and a dim echo of allusions to other films .,1
This deeply spiritual film taps into the meaning and consolation in afterlife communications .,3
Handsome and sophisticated approach to the workplace romantic comedy .,3
The problematic characters and overly convenient plot twists foul up Shum 's good intentions .,1
Wang Xiaoshuai directs this intricately structured and well-realized drama that presents a fascinating glimpse of urban life and the class warfare that embroils two young men .,3
A certain sexiness underlines even the dullest tangents .,3
"Even if it made its original release date last fall , it would 've reeked of a been-there , done-that sameness .",1
"Watching Harris ham it up while physically and emotionally disintegrating over the course of the movie has a certain poignancy in light of his recent death , but Boyd 's film offers little else of consequence .",2
"There 's back-stabbing , inter-racial desire and , most importantly , singing and dancing .",3
Staggeringly dreadful romance .,0
"In the not-too-distant future , movies like Ghost Ship will be used as analgesic balm for overstimulated minds .",1
... built on the premise that middle-class Arkansas consists of monster truck-loving good ol' boys and peroxide blond honeys whose worldly knowledge comes from TV reruns and supermarket tabloids .,1
Disney again ransacks its archives for a quick-buck sequel .,1
Utter mush ... conceited pap .,0
"What a dumb , fun , curiously adolescent movie this is .",3
This is no `` Waterboy ! '',1
"Bloody Sunday has the grace to call for prevention rather than to place blame , making it one of the best war movies ever made .",4
"Though the film is static , its writer-director 's heart is in the right place , his plea for democracy and civic action laudable .",3
"The real triumphs in Igby come from Philippe , who makes Oliver far more interesting than the character 's lines would suggest , and Sarandon , who could n't be better as a cruel but weirdly likable WASP matron .",3
There 's no disguising this as one of the worst films of the summer .,0
They do a good job of painting this family dynamic for the audience but they tried to squeeze too many elements into the film .,2
Less-than-compelling documentary of a Yiddish theater clan .,2
That Storytelling has value can not be denied .,4
Connoisseurs of Chinese film will be pleased to discover that Tian 's meticulous talent has not withered during his enforced hiatus .,3
"That rare documentary that incorporates so much of human experience -- drama , conflict , tears and surprise -- that it transcends the normal divisions between fiction and nonfiction film .",4
A Movie to Forget,1
"Brainy , artistic and muted , almost to the point of suffocation .",2
"As Allen 's execution date closes in , the documentary gives an especially poignant portrait of her friendship with the never flagging legal investigator David Presson .",2
You want to call Domino 's .,2
The film 's only missteps come from the script 's insistence on providing deep emotional motivation for each and every one of Abagnale 's antics .,2
You begin to long for the end credits as the desert does for rain .,0
Those moviegoers who would automatically bypass a hip-hop documentary should give `` Scratch '' a second look .,4
"We never feel anything for these characters , and as a result the film is basically just a curiosity .",1
"The kind of movie that comes along only occasionally , one so unconventional , gutsy and perfectly executed it takes your breath away .",4
The film tries to touch on spousal abuse but veers off course and becomes just another revenge film .,2
Has the marks of a septuagenarian ; it 's a crusty treatment of a clever gimmick .,2
We 're drawn in by the dark luster .,3
"But this time , the old MIB label stands for Milder Is n't Better .",1
"The artwork is spectacular and unlike most animaton from Japan , the characters move with grace and panache .",4
A good thriller .,3
One of the greatest films I 've ever seen .,4
"The people in ABC Africa are treated as docile , mostly wordless ethnographic extras .",2
A wannabe comedy of manners about a brainy prep-school kid with a Mrs. Robinson complex founders on its own preciousness -- and squanders its beautiful women .,1
( It ) has the feel of a summer popcorn movie .,2
"The script is smart , not cloying .",3
"A sleep-inducingly slow-paced crime drama with clumsy dialogue , heavy-handed phoney-feeling sentiment , and an overly-familiar set of plot devices .",0
"Eddie Murphy and Owen Wilson have a cute partnership in I Spy , but the movie around them is so often nearly nothing that their charm does n't do a load of good .",1
It will guarantee to have you leaving the theater with a smile on your face .,4
"Sheridan is painfully bad , a fourth-rate Jim Carrey who does n't understand the difference between dumb fun and just plain dumb .",0
"while ( Roman Coppola ) scores points for style , he staggers in terms of story .",2
"No one can doubt the filmmakers ' motives , but The Guys still feels counterproductive .",1
Entertaining despite its one-joke premise with the thesis that women from Venus and men from Mars can indeed get together .,2
( A ) crushing disappointment .,0
An unfortunate title for a film that has nothing endearing about it .,0
"A visionary marvel , but it 's lacking a depth in storytelling usually found in anime like this .",1
Like being invited to a classy dinner soiree and not knowing anyone .,2
The holiday message of the 37-minute Santa vs. the Snowman leaves a lot to be desired .,1
"A non-Britney person might survive a screening with little harm done , except maybe for the last 15 minutes , which are as maudlin as any after-school special you can imagine .",1
"An ugly , pointless , stupid movie .",0
The film is delicately narrated by Martin Landau and directed with sensitivity and skill by Dana Janklowicz-Mann .,3
"There is a certain sense of experimentation and improvisation to this film that may not always work , but it is nevertheless compelling .",3
"Once folks started hanging out at the barbershop , they never wanted to leave .",3
Movies like High Crimes flog the dead horse of surprise as if it were an obligation .,0
"This is the sort of low-grade dreck that usually goes straight to video -- with a lousy script , inept direction , pathetic acting , poorly dubbed dialogue and murky cinematography , complete with visible boom mikes .",0
"It is most remarkable not because of its epic scope , but because of the startling intimacy it achieves despite that breadth .",4
A flawed film but an admirable one that tries to immerse us in a world of artistic abandon and political madness and very nearly succeeds .,2
"Seeing Seinfeld at home as he watches his own appearance on Letterman with a clinical eye reminds you that the key to stand-up is to always make it look easy , even though the reality is anything but .",2
"If they broke out into elaborate choreography , singing and finger snapping it might have held my attention , but as it stands I kept looking for the last exit from Brooklyn .",1
Bolstered by exceptional performances and a clear-eyed take on the economics of dealing and the pathology of ghetto fabulousness .,4
"Though it pretends to expose the life of male hustlers , it 's exploitive without being insightful .",1
"There 's a thin line between likably old-fashioned and fuddy-duddy , and The Count of Monte Cristo ... never quite settles on either side .",2
"Muccino , who directed from his own screenplay , is a canny crowd pleaser , and The Last Kiss ... provides more than enough sentimental catharsis for a satisfying evening at the multiplex .",4
There are scenes of cinematic perfection that steal your heart away .,4
The obligatory break-ups and hook-ups do n't seem to have much emotional impact on the characters .,2
Upper Teens may get cynical .,1
"I never thought I 'd say this , but I 'd much rather watch teens poking their genitals into fruit pies !",1
"scenario that will give most parents pause ... Then , something terrible happens .",2
"Some are fascinating and others are not , and in the end , it is almost a good movie .",2
"Schnieder bounces around with limp wrists , wearing tight tummy tops and hip huggers , twirling his hair on his finger and assuming that 's enough to sustain laughs ...",1
"a huge disappointment coming , as it does , from filmmakers and performers of this calibre",0
"A culture-clash comedy that , in addition to being very funny , captures some of the discomfort and embarrassment of being a bumbling American in Europe .",3
This version does justice both to Stevenson and to the sci-fi genre .,3
"Broomfield 's style of journalism is hardly journalism at all , and even those with an avid interest in the subject will grow impatient .",1
He nonetheless appreciates the art and reveals a music scene that transcends culture and race .,4
Will certainly appeal to Asian cult cinema fans and Asiaphiles interested to see what all the fuss is about .,3
Leigh succeeds in delivering a dramatic slap in the face that 's simultaneously painful and refreshing .,3
"... very funny , very enjoyable ...",4
A wild ride with eight boarders from Venice Beach that was a deserved co-winner of the Audience Award for documentaries at the Sundance Film Festival .,4
"Klein , charming in comedies like American Pie and dead-on in Election , delivers one of the saddest action hero performances ever witnessed .",1
Although it does n't always hang together -- violence and whimsy do n't combine easily -- `` Cherish '' certainly is n't dull .,2
One of the more glaring signs of this movie 's servitude to its superstar is the way it skirts around any scenes that might have required genuine acting from Ms. Spears .,0
"An unforgettable look at morality , family , and social expectation through the prism of that omnibus tradition called marriage .",3
"An elegant work , Food of Love is as consistently engaging as it is revealing .",3
A tasty masala .,3
"Cockettes has the glorious , gaudy benefit of much stock footage of Those Days , featuring all manner of drag queen , bearded lady and lactating hippie .",2
"Egoyan 's work often elegantly considers various levels of reality and uses shifting points of view , but here he has constructed a film so labyrinthine that it defeats his larger purpose .",2
You could love Safe Conduct ( Laissez Passer ) for being a subtitled French movie that is 170 minutes long .,2
"After Collateral Damage , you might imagine that most every aggrieved father cliché has been unturned .",0
The very definition of what critics have come to term an `` ambitious failure . '',1
"It 's far from a frothy piece , and the characters are complex , laden with plenty of baggage and tinged with tragic undertones .",3
"It 's a feel-bad ending for a depressing story that throws a bunch of hot-button items in the viewer 's face and asks to be seen as hip , winking social commentary .",0
"A gem , captured in the unhurried , low-key style favored by many directors of the Iranian new wave .",2
Moonlight Mile does n't quite go the distance but the cast is impressive and they all give life to these broken characters who are trying to make their way through this tragedy .,3
"The setting is so cool that it chills the characters , reducing our emotional stake in the outcome of `` Intacto 's '' dangerous and seductively stylish game .",2
Many a parent and their teen ( or preteen ) kid could bond while watching A Walk To Remember .,4
"While Bollywood/Hollywood will undoubtedly provide its keenest pleasures to those familiar with Bombay musicals , it also has plenty for those ( like me ) who are n't .",3
... a trashy little bit of fluff stuffed with enjoyable performances and a bewildering sense of self-importance,2
The Sundance Film Festival has become so buzz-obsessed that fans and producers descend upon Utah each January to ferret out The Next Great Thing .,2
Really dumb but occasionally really funny .,2
The film is a fierce dance of destruction .,3
It made me realize that we really have n't had a good cheesy B-movie playing in theaters since ... well ... since last week 's Reign of Fire .,1
An awful movie that will only satisfy the most emotionally malleable of filmgoers .,0
The immersive powers of the giant screen and its hyper-realistic images are put to perfect use in the breathtakingly beautiful outer-space documentary Space Station 3D .,4
"The script is a tired one , with few moments of joy rising above the stale material .",1
This is the first film I 've ever seen that had no obvious directing involved .,2
Real Women Have Curves wears its empowerment on its sleeve but even its worst harangues are easy to swallow thanks to remarkable performances by Ferrera and Ontiveros .,3
"A boring masquerade ball where normally good actors , even Kingsley , are made to look bad .",1
Do we really need another film that praises female self-sacrifice ?,1
You do n't know whether to admire the film 's stately nature and call it classicism or be exasperated by a noticeable lack of pace .,1
"It is sentimental but feels free to offend , is analytical and then surrenders to the illogic of its characters , is about grief and yet permits laughter .",4
"It 's not a classic spy-action or buddy movie , but it 's entertaining enough and worth a look .",2
"If I could have looked into my future and saw how bad this movie was , I would go back and choose to skip it .",0
"The only problem is that , by the end , no one in the audience or the film seems to really care .",0
"Writer-director Walter Hill and co-writer David Giler try to create characters out of the obvious cliches , but wind up using them as punching bags .",1
"Nevertheless , it still seems endless .",1
If you open yourself up to Mr. Reggio 's theory of this imagery as the movie 's set ... it can impart an almost visceral sense of dislocation and change .,3
"There are cheesy backdrops , ridiculous action sequences , and many tired jokes about men in heels .",0
"The film has the high-buffed gloss and high-octane jolts you expect of De Palma , but what makes it transporting is that it 's also one of the smartest , most pleasurable expressions of pure movie love to come from an American director in years .",3
"Ice Age wo n't drop your jaw , but it will warm your heart , and I 'm giving it a strong thumbs up .",3
"Bad in such a bizarre way that it 's almost worth seeing , if only to witness the crazy confluence of purpose and taste .",2
"If you do n't flee , you might be seduced .",2
... although this idea is `` new '' the results are tired .,1
The dragons are the real stars of Reign of Fire and you wo n't be disappointed .,3
The entire film is one big excuse to play one lewd scene after another .,0
"Hampered -- no , paralyzed -- by a self-indulgent script ... that aims for poetry and ends up sounding like satire .",0
"A timid , soggy near miss .",1
"Ice Age is the first computer-generated feature cartoon to feel like other movies , and that makes for some glacial pacing early on .",2
Paul Bettany is cool .,3
"We could have expected a little more human being , and a little less product .",2
"Bacon keeps things interesting , but do n't go out of your way to pay full price .",2
"Skins has a desolate air , but Eyre , a Native American raised by white parents , manages to infuse the rocky path to sibling reconciliation with flashes of warmth and gentle humor .",3
"What enlivens this film , beyond the astute direction of Cardoso and beautifully detailed performances by all of the actors , is a note of defiance over social dictates .",3
"Nohe 's documentary about the event is sympathetic without being gullible : He is n't blind to the silliness , but also captures moments of spontaneous creativity and authentic co-operative interaction .",3
That the Chuck Norris `` grenade gag '' occurs about 7 times during Windtalkers is a good indication of how serious-minded the film is .,2
"The ensemble cast turns in a collectively stellar performance , and the writing is tight and truthful , full of funny situations and honest observations .",4
Possibly not since Grumpy Old Men have I heard a film so solidly connect with one demographic while striking out with another .,2
"Functions as both a revealing look at the collaborative process and a timely , tongue-in-cheek profile of the corporate circus that is the recording industry in the current climate of mergers and downsizing .",3
"This is a finely written , superbly acted offbeat thriller .",4
"We have poignancy jostling against farce , thoughtful dialogue elbowed aside by one-liners , and a visual style that incorporates rotoscope animation for no apparent reason except , maybe , that it looks neat .",1
"Light the candles , bring out the cake and do n't fret about the calories because there 's precious little substance in Birthday Girl -- it 's simply , and surprisingly , a nice , light treat .",4
An unsophisticated sci-fi drama that takes itself all too seriously .,1
"Often overwrought and at times positively irritating , the film turns into an engrossing thriller almost in spite of itself .",2
Trying to make head or tail of the story in the hip-hop indie Snipes is enough to give you brain strain -- and the pay-off is negligible .,1
Do n't hate El Crimen del Padre Amaro because it 's anti-Catholic .,2
Tries so hard to be quirky and funny that the strain is all too evident .,0
"` Martin Lawrence Live ' is so self-pitying , I almost expected there to be a collection taken for the comedian at the end of the show .",0
"The cameo-packed , M : I-2-spoofing title sequence is the funniest 5 minutes to date in this spy comedy franchise ... Then Mike Myers shows up and ruins everything .",2
"What makes Salton Sea surprisingly engrossing is that Caruso takes an atypically hypnotic approach to a world that 's often handled in fast-edit , hopped-up fashion .",4
"In its treatment of the dehumanizing and ego-destroying process of unemployment , Time Out offers an exploration that is more accurate than anything I have seen in an American film .",3
"The emotion is impressively true for being so hot-blooded , and both leads are up to the task .",4
"Fierce , glaring and unforgettable .",3
One gets the impression the creators of Do n't Ask Do n't Tell laughed a hell of a lot at their own jokes .,2
"The Hours , a delicately crafted film , is an impressive achievement in spite of a river of sadness that pours into every frame .",3
Cage makes an unusual but pleasantly haunting debut behind the camera .,3
"Using a stock plot , About a Boy injects just enough freshness into the proceedings to provide an enjoyable 100 minutes in a movie theater .",3
"Despite the predictable parent vs. child coming-of-age theme , first-class , natural acting and a look at `` the real Americans '' make this a charmer .",4
"Any reasonably creative eighth-grader could have written a more credible script , though with the same number of continuity errors .",0
Eight Legged Freaks ?,1
"Handled correctly , Wilde 's play is a masterpiece of elegant wit and artifice .",4
"While this film has an ` A ' list cast and some strong supporting players , the tale -- like its central figure , Vivi -- is just a little bit hard to love .",1
"As a girl-meets-girl romantic comedy , Kissing Jessica Steinis quirky , charming and often hilarious .",4
"There may have been a good film in `` Trouble Every Day , '' but it is not what is on the screen .",1
As tricky and satisfying as any of David Mamet 's airless cinematic shell games .,3
Befuddled in its characterizations as it begins to seem as long as the two year affair which is its subject,1
"Beneath the uncanny , inevitable and seemingly shrewd facade of movie-biz farce ... lies a plot cobbled together from largely flat and uncreative moments .",0
"These three films form a remarkably cohesive whole , both visually and thematically , through their consistently sensitive and often exciting treatment of an ignored people .",4
"Officially , it is twice as bestial but half as funny .",1
Chaiken ably balances real-time rhythms with propulsive incident .,3
"A weird little movie that 's amusing enough while you watch it , offering fine acting moments and pungent insights into modern L.A. 's show-biz and media subcultures .",3
A fascinating case study of flower-power liberation -- and the price that was paid for it .,4
Vincent Gallo is right at home in this French shocker playing his usual bad boy weirdo role .,3
"Schaeffer is n't in this film , which may be why it works as well as it does .",3
"This film is an act of spiritual faith -- an eloquent , deeply felt meditation on the nature of compassion .",3
"What 's not to like about a movie with a ` children 's ' song that includes the line ` My stepdad 's not mean , he 's just adjusting ' ?",3
